<?xml version="1.0" encoding="UTF-8"?>
<traits xmlns:xsi="http://www.w3.org/2001/XMLSchema-instance"
	xsi:noNamespaceSchemaLocation="validation/pendragon-model-trait.xsd">
	<trait>
		<positive>chaste</positive>
		<negative>lustful</negative>
	</trait>
	<trait>
		<positive>energetic</positive>
		<negative>lazy</negative>
	</trait>
	<trait>
		<positive>forgiving</positive>
		<negative>vengeful</negative>
	</trait>
	<trait>
		<positive>generous</positive>
		<negative>selfish</negative>
	</trait>
	<trait>
		<positive>honest</positive>
		<negative>deceitful</negative>
	</trait>
	<trait>
		<positive>just</positive>
		<negative>arbitrary</negative>
	</trait>
	<trait>
		<positive>merciful</positive>
		<negative>cruel</negative>
	</trait>
	<trait>
		<positive>modest</positive>
		<negative>proud</negative>
	</trait>
	<trait>
		<positive>pious</positive>
		<negative>worldly</negative>
	</trait>
	<trait>
		<positive>prudent</positive>
		<negative>reckless</negative>
	</trait>
	<trait>
		<positive>temperate</positive>
		<negative>indulgent</negative>
	</trait>
	<trait>
		<positive>trusting</positive>
		<negative>suspicious</negative>
	</trait>
	<trait>
		<positive>valorous</positive>
		<negative>cowardly</negative>
	</trait>
</traits>